<?xml version="1.0" encoding="UTF-8"?>
<school xmlns:xsi="http://www.w3.org/2001/XMLSchema-instance"
        xsi:noNamespaceSchemaLocation="student_ID.xsd">
    <student id="SV01">
        <name>Nguyễn Thị Thanh Thủy</name>
        <date>1997-12-20</date>
    </student>
    <student id="SV02">
        <name>Lê Thị Hồng Cẩm</name>
        <date>1998-1-21</date>
    </student>
    <class ref="SV01">Class A</class>
    <class ref="SV02">Class A</class>
</school>